Finding ID,Source Audit File,Module,Route,Screen,Persona,User Journey,Severity,Original Finding,Root Cause,Fix Decision,Code Files Changed,Test Evidence,Runtime Evidence,Screenshot Path,Status,Notes
CAT-0001,catalyst_p0_p1_static_findings_1000.csv,Test Hub,,,,,P0,"source_test_case_id: input.source_test_case_id ?? null,","QA defect lineage can be saved without a test case, breaking requirement→case→run→defect traceability.","Make source_test_case_id mandatory for QA defect creation from TestHub, or route standalone defects outside QA lineage. (Slice 1)",src/hooks/test-management/useDefects.ts,manual code read-through; tsc --noEmit 0 errors project-wide,Live-verified via Chrome MCP against localhost:8080 dev server (see catalyst-runtime-proof-report.md).,,Fixed,Closed in CAT-AUDIT-REMEDIATION-20260705-001 Slice 1.
CAT-0002,catalyst_p0_p1_static_findings_1000.csv,Test Hub,,,,,P0,"source_test_run_id: input.source_test_run_id ?? null,","QA defect lineage can be saved without a test execution run, so failure evidence is optional.",Require source_test_run_id for defects raised from execution and show the originating run on detail. (Slice 1),src/hooks/test-management/useDefects.ts,manual code read-through; tsc --noEmit 0 errors project-wide,Live-verified via Chrome MCP against localhost:8080 dev server (see catalyst-runtime-proof-report.md).,,Fixed,Closed in CAT-AUDIT-REMEDIATION-20260705-001 Slice 1.
CAT-0003,catalyst_p0_p1_static_findings_1000.csv,Test Hub,,,,,P1,"source_test_plan_id: input.source_test_plan_id ?? null,","Defect can lack test-plan context, weakening release/test-plan readiness reports.",Derive or require source_test_plan_id when a defect is created from a cycle/plan.,,,,,Deferred,Staged for Test Hub remediation wave per docs/audits/catalyst-remediation-plan.md wave order.
CAT-0004,catalyst_p0_p1_static_findings_1000.csv,Test Hub,,,,,P0,onCreate: async ({ title }) => {,"The defects list quick-create sends only title/project/default severity, creating standalone QA bugs without case/run/evidence.",Remove quick-create for QA Bugs or open a guided defect-from-evidence flow. (Slice 1),src/modules/project-work-hub/adapters/defectsDataSource.ts,manual code read-through; tsc --noEmit 0 errors project-wide,Live-verified via Chrome MCP against localhost:8080 dev server (see catalyst-runtime-proof-report.md).,,Fixed,Closed in CAT-AUDIT-REMEDIATION-20260705-001 Slice 1.
CAT-0005,catalyst_p0_p1_static_findings_1000.csv,Test Hub,,,,,P0,if (selectedCaseIds.size > 0) {,"Cycle creation adds cases only when selected cases exist, so an empty cycle can be saved.","Block Create Cycle until at least one approved/published case is selected, or mark it Draft/Not executable. (Slice 1)",src/pages/testhub/cycles/CyclesPage.tsx,manual code read-through; tsc --noEmit 0 errors project-wide,Live-verified via Chrome MCP against localhost:8080 dev server (see catalyst-runtime-proof-report.md).,,Fixed,Closed in CAT-AUDIT-REMEDIATION-20260705-001 Slice 1.
CAT-0006,catalyst_p0_p1_static_findings_1000.csv,Test Hub,,,,,P1,No steps defined for this test case — record a case-level verdict instead.,The runner explicitly allows case-level verdict for a test case with no steps; evidence rigor can degrade silently.,"Require steps for formal cases, or make no-step execution an explicit exploratory/session case type.",,,,,Deferred,Staged for Test Hub remediation wave per docs/audits/catalyst-remediation-plan.md wave order.
CAT-0007,catalyst_p0_p1_static_findings_1000.csv,Test Hub,,,,,P1,if (run && stepStates.length > 0) {,Step result rows are only inserted when stepStates exist; no-step cases produce no step-level evidence.,Show evidence granularity and require actual-result notes/attachments for no-step failed cases.,,,,,Deferred,Staged for Test Hub remediation wave per docs/audits/catalyst-remediation-plan.md wave order.
CAT-0008,catalyst_p0_p1_static_findings_1000.csv,Incident Hub,,,,,P1,"3. **`ph_issue_id`-linked governance defaults are coarse.** All 152 backfilled incidents got `impact='medium'`, `urgency='medium'`, `support_level='L1'` uniformly (no real signal existed for these in Jira) — so `priority` is P3 for all of t","Backfilled incident impact/urgency/support level are uniform defaults, so priority can look meaningful when it is not.",Display “needs triage review” and require real impact/urgency/support-level classification.,,,,,Deferred,Staged for Incident Hub remediation wave per docs/audits/catalyst-remediation-plan.md wave order.
CAT-0009,catalyst_p0_p1_static_findings_1000.csv,Incident Hub,,,,,P0,"4. **No SLA breach *alerting*.** The DB now correctly computes ""is this breaching right now"" (`incident_sla_live_status`), but nothing surfaces it to a user yet — no toast, badge, or notification wired. That data is ready to consume; UI isn",SLA breach computation exists but the handover says no user-facing alert/badge/notification is wired.,"Surface live SLA status on dashboard, list, detail, board cards, notifications, and reports.",,,,,Deferred,P0 but scoped to Incident Hub wave (Slice 3+); depends on re-verifying features/CAT-INCIDENT-GOVERNANCE-20260703-001/07_HANDOVER.md currency first.
CAT-0010,catalyst_p0_p1_static_findings_1000.csv,Incident Hub,,,,,P1,"6. **Historical MTTR / migration path.** 137 ""closed"" backfilled incidents have no `resolved_at`/`closed_at` timestamps set (only `status`), so any MTTR calc against the native table for historical incidents will be wrong/empty. Real MTTR d","Closed historical incidents can lack resolved_at/closed_at, making native historical MTTR empty or misleading.",Add capture-window disclosure and avoid historical MTTR charts until source history exists.,,,,,Deferred,Staged for Incident Hub remediation wave per docs/audits/catalyst-remediation-plan.md wave order.
CAT-0011,catalyst_p0_p1_static_findings_1000.csv,Incident Hub,,,,,P1,7. **`incidentLifecycle.ts`'s `STATUS_TRANSITIONS` may not fully match the DB.** I verified `derive_incident_priority()` and SLA numbers against the DB and fixed the drift; I did NOT cross-check every status transition rule against DB trigg,Incident status transition UI risk is documented because frontend lifecycle rules may not match DB constraints.,Prove every UI transition against DB transition constraints before exposing status buttons.,,,,,Deferred,Staged for Incident Hub remediation wave per docs/audits/catalyst-remediation-plan.md wave order.
CAT-0012,catalyst_p0_p1_static_findings_1000.csv,Incident Hub,,,,,P0,"5. **Committee Queue page is functional but minimal.** No ""Approve""/""Veto"" buttons wired in the drawer yet (the mutations exist: `useRecordApproval`, `useRecordVeto`, `useTransitionOnApproval` in `src/hooks/useCommitteeQueue.ts` — page just","The handover documents missing Approve/Veto and Send-to-Committee paths at that point, making governance non-operable without later fixes.","Keep these as regression tests: committee send, approve, veto, aggregate, and incident-state update.",,,,,Deferred,P0 but scoped to Incident Hub wave (Slice 3+); depends on re-verifying features/CAT-INCIDENT-GOVERNANCE-20260703-001/07_HANDOVER.md currency first.
CAT-0013,catalyst_p0_p1_static_findings_1000.csv,Release Hub,,,,,P1,createRelease.mutate(,"Release can be created from metadata fields without declaring scope, test evidence, signoffs, freeze-window check, or rollback plan.",Introduce release readiness wizard/checklist before status can progress beyond draft.,,,,,Deferred,Staged for Release Hub remediation wave per docs/audits/catalyst-remediation-plan.md wave order.
CAT-0014,catalyst_p0_p1_static_findings_1000.csv,Release Hub,,,,,P1,"<Route path=""/release-hub/releases-management"" element={<S><ReleasesPageLazy /></S>} />","Release Hub has releases-management detail routes and also a catch-all release detail route, creating URL-model ambiguity.",Use one canonical release URL; redirect or delete the fallback once inbound links are migrated.,,,,,Deferred,Staged for Release Hub remediation wave per docs/audits/catalyst-remediation-plan.md wave order.
CAT-0015,catalyst_p0_p1_static_findings_1000.csv,Release Hub,,,,,P1,"<Route path=""/release-hub/:releaseId"" element={<S><ReleaseDetailPage /></S>} />",The `/release-hub/:releaseId` fallback can compete mentally with `/release-hub/releases-management/:releaseSlug`.,"Publish one URL contract and update route builders, toasts, links, and docs.",,,,,Deferred,Staged for Release Hub remediation wave per docs/audits/catalyst-remediation-plan.md wave order.
CAT-0016,catalyst_p0_p1_static_findings_1000.csv,STRATA / Strategy,,,,,P1,"<Route path=""*"" element={<S><CommandCenterPage /></S>} />","Unknown STRATA deep links silently render Command Center, masking broken navigation and audit evidence.",Replace wildcard fallback with module-specific NotFound/recovery that preserves broken URL evidence.,,,,,Deferred,Staged for STRATA / Strategy remediation wave per docs/audits/catalyst-remediation-plan.md wave order.
CAT-0017,catalyst_p0_p1_static_findings_1000.csv,STRATA / Strategy,,,,,P1,export interface StrataKpi extends GovernedEnvelope {,"KPI model is rich, but the UI must enforce business meaning, owner, validator, threshold scheme, and data source before approval.",Add KPI readiness checklist and block approve/live until required governance fields are complete.,,,,,Deferred,Staged for STRATA / Strategy remediation wave per docs/audits/catalyst-remediation-plan.md wave order.
CAT-0018,catalyst_p0_p1_static_findings_1000.csv,STRATA / Strategy,,,,,P1,validation_status: ValidationStatus;,KPI actuals carry validation_status and confidence; scorecards must display these or executives may trust unvalidated data.,"Show validation/confidence badges in KPI detail, scorecard lines, and board packs.",,,,,Deferred,Staged for STRATA / Strategy remediation wave per docs/audits/catalyst-remediation-plan.md wave order.
CAT-0019,catalyst_p0_p1_static_findings_1000.csv,Chat,,,,,P1,- Mobile <1024px layout; read receipts (no schema); slash commands; fenced code blocks;,Chat handover documents hardcoded English strings and incomplete full-shell RTL mirroring.,"Move chat strings to i18n and run Arabic/RTL screenshot proof across shell, modals, composer, and dock.",,,,,Deferred,Staged for Chat remediation wave per docs/audits/catalyst-remediation-plan.md wave order.
CAT-0020,catalyst_p0_p1_static_findings_1000.csv,Chat,,,,,P1,- Mobile <1024px slice: single-content-column grid branching via new useMediaQuery; desktop,Mobile layout branch was code-reviewed but runtime proof was blocked.,"Collect <1024px screenshots and Playwright/DOM proof for Home, DM, channel, thread, search, huddle, and composer.",,,,,Deferred,Staged for Chat remediation wave per docs/audits/catalyst-remediation-plan.md wave order.
CAT-0021,catalyst_p0_p1_static_findings_1000.csv,Chat,,,,,P1,"- Some activity rows show ""Someone"" — staging seed users missing profile rows (data, not code).","Some activity rows can show “Someone”, degrading enterprise identity clarity.",Enforce profile joins/fallbacks and show accountable missing-profile diagnostic.,,,,,Deferred,Staged for Chat remediation wave per docs/audits/catalyst-remediation-plan.md wave order.
CAT-0022,catalyst_p0_p1_static_findings_1000.csv,Chat,,,,,P1,"- Silent error-swallowing pattern across chat hooks (intentional degradation, zero logging).",Silent error-swallowing is documented across chat hooks.,Replace silent degradation with visible non-blocking error states and structured warnings.,,,,,Deferred,Staged for Chat remediation wave per docs/audits/catalyst-remediation-plan.md wave order.
CAT-0023,catalyst_p0_p1_static_findings_1000.csv,Chat,,,,,P1,"- CATY dock (separate v1 surface, own dock.css) got the pill-row craft + legible section",Dock has documented pre-existing broken tests.,Fix AuthProvider wrapper/stale splitPinnedFavourites tests and gate dock changes with CI.,,,,,Deferred,Staged for Chat remediation wave per docs/audits/catalyst-remediation-plan.md wave order.
CAT-0024,catalyst_p0_p1_static_findings_1000.csv,Chat,,,,,P1,"Vikram review: ""text is like ants… work very hard on the typography"". Root cause: ~160 uses of",Chat typography previously used very small body tokens at scale; this must remain a regression guard.,Add typography snapshot/audit to prevent return of 11px body text in chat surfaces.,,,,,Deferred,Staged for Chat remediation wave per docs/audits/catalyst-remediation-plan.md wave order.
CAT-0025,catalyst_p0_p1_static_findings_1000.csv,Test Hub,,,,,P1,// Placeholder for potential detail view,Placeholder surface can leak unfinished design into production journeys.,Replace with canonical empty state or remove route/menu exposure.,,,,,Deferred,Staged for Test Hub remediation wave per docs/audits/catalyst-remediation-plan.md wave order.
CAT-0026,catalyst_p0_p1_static_findings_1000.csv,Test Hub,,,,,P1,"const { cycleKey, id: legacyId, projectKey = 'BAU' } = useParams<{ cycleKey?: string; id?: string; projectKey?: string }>();",Legacy code/route/copy creates split mental models and old/new surface ambiguity.,Retire or redirect with measurable canonical ownership.,,,,,Deferred,Staged for Test Hub remediation wave per docs/audits/catalyst-remediation-plan.md wave order.
CAT-0027,catalyst_p0_p1_static_findings_1000.csv,Test Hub,,,,,P1,// aren't serializable into localStorage) — warn instead of silently,Silent behavior hides user-impacting failure.,Show visible error/retry path and log structured breadcrumb.,,,,,Deferred,Staged for Test Hub remediation wave per docs/audits/catalyst-remediation-plan.md wave order.
CAT-0028,catalyst_p0_p1_static_findings_1000.csv,Test Hub,,,,,P1,"<div style={{ display: 'flex', alignItems: 'center', justifyContent: 'center', minHeight: '100%', padding: 48 }}>",Inline/local style bypasses canonical spacing/typography/density governance.,Move styling into canonical components/tokens or register an exception.,,,,,Deferred,"Staged for module UI-standardization batch pass (mechanical inline-style/token-migration sweep), not yet scheduled to a slice."
CAT-0029,catalyst_p0_p1_static_findings_1000.csv,Test Hub,,,,,P1,const cycleParam = cycleKey ?? legacyId;,Legacy code/route/copy creates split mental models and old/new surface ambiguity.,Retire or redirect with measurable canonical ownership.,,,,,Deferred,Staged for Test Hub remediation wave per docs/audits/catalyst-remediation-plan.md wave order.
CAT-0030,catalyst_p0_p1_static_findings_1000.csv,Test Hub,,,,,P1,const createCase = useCreateTestCase({ silent: true });,Silent behavior hides user-impacting failure.,Show visible error/retry path and log structured breadcrumb.,,,,,Deferred,Staged for Test Hub remediation wave per docs/audits/catalyst-remediation-plan.md wave order.
CAT-0031,catalyst_p0_p1_static_findings_1000.csv,Test Hub,,,,,P1,style={{,Inline/local style bypasses canonical spacing/typography/density governance.,Move styling into canonical components/tokens or register an exception.,,,,,Deferred,"Staged for module UI-standardization batch pass (mechanical inline-style/token-migration sweep), not yet scheduled to a slice."
CAT-0032,catalyst_p0_p1_static_findings_1000.csv,Test Hub,,,,,P1,"id: legacyId,",Legacy code/route/copy creates split mental models and old/new surface ambiguity.,Retire or redirect with measurable canonical ownership.,,,,,Deferred,Staged for Test Hub remediation wave per docs/audits/catalyst-remediation-plan.md wave order.
CAT-0033,catalyst_p0_p1_static_findings_1000.csv,Test Hub,,,,,P1,* 'draft'/'planned' and 'active'/'in_progress' as silent duplicate,Silent behavior hides user-impacting failure.,Show visible error/retry path and log structured breadcrumb.,,,,,Deferred,Staged for Test Hub remediation wave per docs/audits/catalyst-remediation-plan.md wave order.
CAT-0034,catalyst_p0_p1_static_findings_1000.csv,Test Hub,,,,,P1,"padding: 48,",Ad-hoc padding fragments spacing rhythm and viewport density.,Use canonical spacing tokens/layout primitives.,,,,,Deferred,"Staged for module UI-standardization batch pass (mechanical inline-style/token-migration sweep), not yet scheduled to a slice."
CAT-0035,catalyst_p0_p1_static_findings_1000.csv,Test Hub,,,,,P1,const cycleParam = cycleKey ?? legacyId;,Legacy code/route/copy creates split mental models and old/new surface ambiguity.,Retire or redirect with measurable canonical ownership.,,,,,Deferred,Staged for Test Hub remediation wave per docs/audits/catalyst-remediation-plan.md wave order.
CAT-0036,catalyst_p0_p1_static_findings_1000.csv,Test Hub,,,,,P1,"* (destroying step identity, and — before P1-S1's soft-delete — silently",Silent behavior hides user-impacting failure.,Show visible error/retry path and log structured breadcrumb.,,,,,Deferred,Staged for Test Hub remediation wave per docs/audits/catalyst-remediation-plan.md wave order.
CAT-0037,catalyst_p0_p1_static_findings_1000.csv,Test Hub,,,,,P1,"<div style={{ fontFamily: 'var(--ds-font-family-code)', color: 'var(--ds-text-subtlest)', fontSize: 'var(--ds-font-size-200)' }}>",Inline/local style bypasses canonical spacing/typography/density governance.,Move styling into canonical components/tokens or register an exception.,,,,,Deferred,"Staged for module UI-standardization batch pass (mechanical inline-style/token-migration sweep), not yet scheduled to a slice."
CAT-0038,catalyst_p0_p1_static_findings_1000.csv,Test Hub,,,,,P1,"const { cycleKey, id: legacyId, projectKey = 'BAU' } = useParams<{ cycleKey?: string; id?: string; projectKey?: string }>();",Legacy code/route/copy creates split mental models and old/new surface ambiguity.,Retire or redirect with measurable canonical ownership.,,,,,Deferred,Staged for Test Hub remediation wave per docs/audits/catalyst-remediation-plan.md wave order.
CAT-0039,catalyst_p0_p1_static_findings_1000.csv,Test Hub,,,,,P1,export function useCreateTestCase(options?: { silent?: boolean }) {,Silent behavior hides user-impacting failure.,Show visible error/retry path and log structured breadcrumb.,,,,,Deferred,Staged for Test Hub remediation wave per docs/audits/catalyst-remediation-plan.md wave order.
CAT-0040,catalyst_p0_p1_static_findings_1000.csv,Test Hub,,,,,P1,<div style={{ color: 'var(--ds-text)' }}>,Inline/local style bypasses canonical spacing/typography/density governance.,Move styling into canonical components/tokens or register an exception.,,,,,Deferred,"Staged for module UI-standardization batch pass (mechanical inline-style/token-migration sweep), not yet scheduled to a slice."
CAT-0041,catalyst_p0_p1_static_findings_1000.csv,Test Hub,,,,,P1,const cycleParam = cycleKey ?? legacyId;,Legacy code/route/copy creates split mental models and old/new surface ambiguity.,Retire or redirect with measurable canonical ownership.,,,,,Deferred,Staged for Test Hub remediation wave per docs/audits/catalyst-remediation-plan.md wave order.
CAT-0042,catalyst_p0_p1_static_findings_1000.csv,Test Hub,,,,,P1,const silent = options?.silent ?? false;,Silent behavior hides user-impacting failure.,Show visible error/retry path and log structured breadcrumb.,,,,,Deferred,Staged for Test Hub remediation wave per docs/audits/catalyst-remediation-plan.md wave order.
CAT-0043,catalyst_p0_p1_static_findings_1000.csv,Test Hub,,,,,P1,"<div style={{ display: 'flex', gap: 4 }}>",Inline/local style bypasses canonical spacing/typography/density governance.,Move styling into canonical components/tokens or register an exception.,,,,,Deferred,"Staged for module UI-standardization batch pass (mechanical inline-style/token-migration sweep), not yet scheduled to a slice."
CAT-0044,catalyst_p0_p1_static_findings_1000.csv,Test Hub,,,,,P1,"DEPRECATED: { appearance: 'removed',    label: 'Deprecated' },",Deprecated code/route/copy creates split mental models and old/new surface ambiguity.,Retire or redirect with measurable canonical ownership.,,,,,Deferred,Staged for Test Hub remediation wave per docs/audits/catalyst-remediation-plan.md wave order.
CAT-0045,catalyst_p0_p1_static_findings_1000.csv,Test Hub,,,,,P1,if (!silent) {,Silent behavior hides user-impacting failure.,Show visible error/retry path and log structured breadcrumb.,,,,,Deferred,Staged for Test Hub remediation wave per docs/audits/catalyst-remediation-plan.md wave order.
CAT-0046,catalyst_p0_p1_static_findings_1000.csv,Test Hub,,,,,P1,"<div style={{ padding: 32, display: 'flex', justifyContent: 'center' }}>",Inline/local style bypasses canonical spacing/typography/density governance.,Move styling into canonical components/tokens or register an exception.,,,,,Deferred,"Staged for module UI-standardization batch pass (mechanical inline-style/token-migration sweep), not yet scheduled to a slice."
CAT-0047,catalyst_p0_p1_static_findings_1000.csv,Test Hub,,,,,P1,"deprecated: { appearance: 'removed',    label: 'Deprecated' },",Deprecated code/route/copy creates split mental models and old/new surface ambiguity.,Retire or redirect with measurable canonical ownership.,,,,,Deferred,Staged for Test Hub remediation wave per docs/audits/catalyst-remediation-plan.md wave order.
CAT-0048,catalyst_p0_p1_static_findings_1000.csv,Test Hub,,,,,P1,export function useCloneTestCase(options?: { silent?: boolean }) {,Silent behavior hides user-impacting failure.,Show visible error/retry path and log structured breadcrumb.,,,,,Deferred,Staged for Test Hub remediation wave per docs/audits/catalyst-remediation-plan.md wave order.
CAT-0049,catalyst_p0_p1_static_findings_1000.csv,Test Hub,,,,,P1,"return <div style={{ padding: 32, color: 'var(--ds-text-danger)' }}>Cycle not found</div>;",Inline/local style bypasses canonical spacing/typography/density governance.,Move styling into canonical components/tokens or register an exception.,,,,,Deferred,"Staged for module UI-standardization batch pass (mechanical inline-style/token-migration sweep), not yet scheduled to a slice."
CAT-0050,catalyst_p0_p1_static_findings_1000.csv,Test Hub,,,,,P1,// active Test Space) only when the route key matches nothing (legacy no-key URL).,Legacy code/route/copy creates split mental models and old/new surface ambiguity.,Retire or redirect with measurable canonical ownership.,,,,,Deferred,Staged for Test Hub remediation wave per docs/audits/catalyst-remediation-plan.md wave order.
CAT-0051,catalyst_p0_p1_static_findings_1000.csv,Test Hub,,,,,P1,const silent = options?.silent ?? false;,Silent behavior hides user-impacting failure.,Show visible error/retry path and log structured breadcrumb.,,,,,Deferred,Staged for Test Hub remediation wave per docs/audits/catalyst-remediation-plan.md wave order.
CAT-0052,catalyst_p0_p1_static_findings_1000.csv,Test Hub,,,,,P1,"<div style={{ padding: 'var(--ds-space-300)', width: '100%', boxSizing: 'border-box', fontFamily: 'var(--ds-font-family-body)' }}>",Inline/local style bypasses canonical spacing/typography/density governance.,Move styling into canonical components/tokens or register an exception.,,,,,Deferred,"Staged for module UI-standardization batch pass (mechanical inline-style/token-migration sweep), not yet scheduled to a slice."
CAT-0053,catalyst_p0_p1_static_findings_1000.csv,Test Hub,,,,,P1,* zero-padding because two generators disagree and legacy imports add more,Legacy code/route/copy creates split mental models and old/new surface ambiguity.,Retire or redirect with measurable canonical ownership.,,,,,Deferred,Staged for Test Hub remediation wave per docs/audits/catalyst-remediation-plan.md wave order.
CAT-0054,catalyst_p0_p1_static_findings_1000.csv,Test Hub,,,,,P1,if (!silent) {,Silent behavior hides user-impacting failure.,Show visible error/retry path and log structured breadcrumb.,,,,,Deferred,Staged for Test Hub remediation wave per docs/audits/catalyst-remediation-plan.md wave order.
CAT-0055,catalyst_p0_p1_static_findings_1000.csv,Test Hub,,,,,P1,<div style={{ marginBottom: 'var(--ds-space-300)' }}>,Inline/local style bypasses canonical spacing/typography/density governance.,Move styling into canonical components/tokens or register an exception.,,,,,Deferred,"Staged for module UI-standardization batch pass (mechanical inline-style/token-migration sweep), not yet scheduled to a slice."
CAT-0056,catalyst_p0_p1_static_findings_1000.csv,Test Hub,,,,,P1,"*   - legacy imported rows → 3-digit (RVTC-001, RVDF-001) and 5-digit (DEF-00001)",Legacy code/route/copy creates split mental models and old/new surface ambiguity.,Retire or redirect with measurable canonical ownership.,,,,,Deferred,Staged for Test Hub remediation wave per docs/audits/catalyst-remediation-plan.md wave order.
CAT-0057,catalyst_p0_p1_static_findings_1000.csv,Test Hub,,,,,P1,// were silent duplicate synonyms; paused had zero UI representation).,Silent behavior hides user-impacting failure.,Show visible error/retry path and log structured breadcrumb.,,,,,Deferred,Staged for Test Hub remediation wave per docs/audits/catalyst-remediation-plan.md wave order.
CAT-0058,catalyst_p0_p1_static_findings_1000.csv,Test Hub,,,,,P1,"<div style={{ display: 'flex', gap: 'var(--ds-space-100)', alignItems: 'center' }}>",Inline/local style bypasses canonical spacing/typography/density governance.,Move styling into canonical components/tokens or register an exception.,,,,,Deferred,"Staged for module UI-standardization batch pass (mechanical inline-style/token-migration sweep), not yet scheduled to a slice."
CAT-0059,catalyst_p0_p1_static_findings_1000.csv,Test Hub,,,,,P1,"// defect via tm_defect_links, real tm_test_runs rows — not a dead/legacy",Legacy code/route/copy creates split mental models and old/new surface ambiguity.,Retire or redirect with measurable canonical ownership.,,,,,Deferred,Staged for Test Hub remediation wave per docs/audits/catalyst-remediation-plan.md wave order.
